sentence	label_name	label_ID	language	Source
The influence of lobbyists and special interest groups on the immigration reform debate cannot be overstated, as they pour millions of dollars into lobbying efforts to sway elected officials.	Political	13	en	Brennan Centre for Justice
Same-sex marriage has become a highly divisive issue in American politics, with conservative politicians using it as a tool to mobilize their base and liberals framing it as a matter of equal rights.	Political	13	en	The Atlantic
In recent years, the debate over immigration has become increasingly politicized, with both major political parties using the issue to appeal to their respective bases.	Political	13	en	Migration Policy Institute
Many politicians who oppose same-sex marriage do so on the grounds of traditional religious beliefs, often ignoring the fact that the separation of church and state is a key tenet of American democracy.	Political	13	en	The Huffington Post
In order to appeal to younger voters, many politicians on the left have embraced same-sex marriage as a key platform issue, framing it as a matter of social justice and equality.	Political	13	en	The Politics of Same-Sex Marriage: Lessons from Australia and the US
Despite the fact that the majority of Americans support immigration reform, politicians on both sides of the aisle have been reluctant to take action on the issue, fearing it will alienate their base.	Political	13	en	Vox
The issue of immigration has become a key issue in election cycles, with politicians using their views on the issue to appeal to their base and differentiate themselves from their opponents.	Political	13	en	Pew Research Centre
Lobbyists for same-sex marriage have played a crucial role in shaping the debate around the issue, using their resources to sway elected officials and shape public opinion through advertising and other media campaigns.	Political	13	en	The New York Times
The fight for same-sex marriage has brought together a diverse coalition of activists and advocacy groups, including LGBT organizations, civil rights groups, and religious organizations who support marriage equality.	Political	13	en	The Atlantic
The issue of immigration reform has become a highly emotional and divisive issue in American politics, with many politicians and voters on both sides of the issue unwilling to compromise or find common ground.	Political	13	en	National Immigration Forum
The Supreme Court's decision on same-sex marriage has been celebrated by LGBTQ activists and allies around the world as a major victory for equality.	External Regulation and Reputation	14	en	Human Rights Campaign
The United States' reputation as a beacon of democracy has been tarnished by its treatment of immigrants and its crackdown on peaceful protests.	External Regulation and Reputation	14	en	Amnesty International
The Biden administration has taken steps to repair America's reputation on the global stage by reversing some of the Trump-era immigration policies.	External Regulation and Reputation	14	en	The Washington Post
The Trump administration's efforts to restrict immigration from certain countries have been criticized for being discriminatory and damaging to the country's reputation.	External Regulation and Reputation	14	en	CNN
Immigration policy has been a key component of American foreign policy since the country's founding, with the reputation of the United States often intertwined with its openness to immigrants.	External Regulation and Reputation	14	en	A Nation of Immigrants
The United States' reputation as a global leader in human rights has been undermined by its treatment of immigrants, particularly those seeking asylum at the southern border.	External Regulation and Reputation	14	en	The Trump Administration's Assault on the US Asylum System
International organizations and human rights groups have criticized the United States for its policies on immigration, including the detention of children and families.	External Regulation and Reputation	14	en	Immigration Policy: Issues and Challenges
The legalization of same-sex marriage in the United States has helped to improve the country's reputation as a leader in human rights and LGBTQ rights.	External Regulation and Reputation	14	en	Beyond Marriage: The Future of LGBTQ Rights and Relationships
The United States' support for same-sex marriage has been a key component of its foreign policy on human rights, with the country working to advance LGBTQ rights globally.	External Regulation and Reputation	14	en	The Guardian
The Obama administration's support for DACA and its efforts to provide a path to citizenship for undocumented immigrants helped to improve the country's reputation on immigration policy.	External Regulation and Reputation	14	en	The Atlantic - The United States Has No Coherent Immigration Policy
The COVID-19 pandemic has brought new challenges to immigration policies, with many countries restricting travel and implementing quarantine measures.	Other	15	en	CharGPT
Discrimination against immigrants and LGBTQ individuals can have profound impacts on mental health, leading to issues like depression, anxiety, and PTSD.	Other	15	en	CharGPT
The intersection of race and immigration is a complex and often overlooked issue, with people of colour facing additional barriers and challenges in the immigration process.	Other	15	en	CharGPT
Same-sex marriage has been a lightning rod for religious conservatives, who argue that it undermines traditional values and the sanctity of marriage.	Other	15	en	CharGPT
The debate around immigration often centers on issues of security and economic stability, with little attention paid to the human rights and dignity of migrants and refugees.	Other	15	en	CharGPT
LGBTQ immigrants often face isolation and a lack of community support, making it difficult to navigate their new lives in a foreign country.	Other	15	en	CharGPT
The issue of immigration is often framed in terms of "us" and "them," leading to dehumanization and stigmatization of immigrants and refugees.	Other	15	en	CharGPT
LGBTQ immigrants often face additional barriers to legal and social recognition, making it difficult to access basic rights and protections.	Other	15	en	CharGPT
The experiences of LGBTQ immigrants and refugees are often overlooked or ignored, leading to additional barriers and challenges in their journeys.	Other	15	en	CharGPT
The idea of a borderless world may seem appealing, but it raises difficult questions around issues like national sovereignty and cultural identity.	Other	15	en	CharGPT