sentence	label_name	label_ID	language	Source
Immigrants are a vital source of labor and innovation, and their contributions are key to sustaining economic growth in the United States.	Economic	1	en	Migration Policy Institute
The benefits of immigration are numerous and include increased economic growth, higher levels of entrepreneurship, and greater cultural diversity.	Economic	1	en	Harvard Business Review
Immigration can be a net positive for the economy, as long as policies are in place to ensure that new arrivals are able to integrate into the labor market and contribute to economic growth.	Economic	1	en	The Economist
Same-sex marriage can have a positive economic impact by boosting tourism, increasing consumer spending, and generating new jobs in the wedding industry.	Economic	1	en	CNN Money
The legalization of same-sex marriage would lead to greater economic security for same-sex couples, as they would be able to access important benefits like Social Security, health insurance, and tax breaks.	Economic	1	en	Centre for American Progress
The economic benefits of same-sex marriage include increased tax revenue, lower government spending on social services, and a boost to the wedding and hospitality industries.	Economic	1	en	Forbes
Immigration policies that emphasize family reunification and attract highly-skilled workers can lead to significant economic benefits, including increased innovation and productivity.	Economic	1	en	World Economic Forum
The economic benefits of immigration are often overlooked, as immigrants contribute to job creation, entrepreneurship, and economic growth in a variety of ways.	Economic	1	en	National Immigration Forum
Allowing same-sex couples to marry would result in significant economic gains for businesses, as they would be able to market to a wider customer base and attract new customers who support marriage equality.	Economic	1	en	inc. magazine
The economic impact of same-sex marriage extends beyond the wedding industry, as it can lead to increased productivity, reduced absenteeism, and improved workplace morale for same-sex couples who are able to access important benefits.	Economic	1	en	Brookings Institution
Immigration can strain the capacity of existing systems, including education, healthcare, and infrastructure, and policymakers need to be mindful of these challenges when designing immigration policies.	Capacity and Resources	2	en	Migration Policy Institute
The capacity of the immigration system to process and adjudicate applications is a major bottleneck, leading to long wait times and backlogs that can delay the arrival of much-needed workers and family members.	Capacity and Resources	2	en	National Immigration Forum
Immigration can put a strain on local resources, including schools, hospitals, and housing, and policymakers need to ensure that these communities have the necessary resources to support newcomers.	Capacity and Resources	2	en	Urban Institute
The capacity of the healthcare system to provide culturally-competent care to immigrants and refugees is critical to ensuring that they receive the care they need and deserve.	Capacity and Resources	2	en	Harvard Health Blog
Same-sex marriage can strain the capacity of existing systems, including family law, estate planning, and healthcare, and policymakers need to be mindful of these challenges when designing policies.	Capacity and Resources	2	en	American Bar Association
The capacity of the legal system to protect the rights of same-sex couples and their families is critical to ensuring that they have equal access to important benefits and protections.	Capacity and Resources	2	en	Human Rights Campaign
Immigration policies that rely on enforcement alone can strain the capacity of law enforcement agencies and divert resources away from more pressing public safety concerns.	Capacity and Resources	2	en	Migration Policy Institute
The capacity of schools to provide a safe and welcoming environment for immigrant students is critical to ensuring their academic success and social integration.	Capacity and Resources	2	en	National Education Association
Same-sex marriage can increase the demand for legal services, including estate planning, tax preparation, and family law, and policymakers need to ensure that the legal system has the capacity to meet this demand.	Capacity and Resources	2	en	American Bar Association
The capacity of social service agencies to provide support to immigrant and refugee families, including housing assistance, language classes, and job training, is critical to ensuring their successful integration into American society.	Capacity and Resources	2	en	National Immigration Forum
The debate over immigration policy is often framed in moral terms, as the treatment of immigrants and refugees speaks to our values as a society.	Morality	3	en	Ethics & International Affairs
Many religious traditions call on us to welcome stranger and offer hospitality to those in need, which has important implications for our approach to immigration policy.	Morality	3	en	American Friends Service Committee
The moral imperative to protect and support vulnerable populations, including children, victims of violence, and asylum seekers, should guide our immigration policies.	Morality	3	en	Human Rights Watch
Immigration policies that prioritize family reunification and offer a pathway to citizenship for undocumented immigrants are more consistent with our moral and ethical values as a nation.	Morality	3	en	Centre for American Progress
The moral and ethical implications of immigration policy extend beyond our borders, as our actions can have life-or-death consequences for people fleeing persecution and seeking safety.	Morality	3	en	Ethics & International Affairs
The moral and ethical implications of same-sex marriage are central to the debate, as the recognition of same-sex couples challenges deeply-held beliefs about the nature of marriage and family.	Morality	3	en	Ethics & International Affairs
Many religious traditions have long held that marriage is a sacred bond between a man and a woman, which has led to opposition to same-sex marriage on moral and ethical grounds.	Morality	3	en	Pew Research Centre
The moral and ethical implications of same-sex marriage extend beyond religious considerations, as the recognition of same-sex couples raises important questions about equality, dignity, and human rights.	Morality	3	en	Human Rights Campaign
Our moral and ethical values as a society demand that we provide equal protection and support to all couples, regardless of their sexual orientation or gender identity.	Morality	3	en	American Civil Liberties Union
The moral and ethical implications of same-sex marriage go beyond the recognition of individual couples, as they also impact the social norms and values that shape our understanding of family and community.	Morality	3	en	Ethics & International Affairs
Immigrants should have access to the same opportunities and resources as anyone else in this country.	Fairness and Equality	4	en	American Immigration Council
Opponents of same-sex marriage argue that it undermines the moral foundation of society, while supporters maintain that it is a matter of justice and equality.	Fairness and Equality	4	en	News by government
Immigrants are not just workers, they are human beings with hopes, dreams, and aspirations.	Fairness and Equality	4	en	Article for trump controversial policies
Equality means that everyone has the same opportunity to succeed, regardless of their background or circumstances.	Fairness and Equality	4	en	The New York Times
Immigrants bring tremendous economic, cultural, and social value to our society, and should be treated with respect and dignity.	Fairness and Equality	4	en	Migration Policy Institute
The issue of same-sex marriage is fundamentally about fairness and equality, as it challenges the exclusionary norms and values that have historically limited the rights and opportunities of LGBTQ+ individuals.	Fairness and Equality	4	en	Southern Poverty Law Centre
The fairness and equality of our immigration policies are essential to maintaining our status as a just and welcoming society that values diversity and inclusivity.	Fairness and Equality	4	en	Human Rights Campaign
A fair and just immigration system must take into account the unique challenges faced by undocumented immigrants and provide them with a pathway to legal status.	Fairness and Equality	4	en	Centre for American Progress
The fairness and equality of our immigration policies have important economic and social implications, as they impact the rights and opportunities of both immigrants and native-born citizens.	Fairness and Equality	4	en	Migration Policy Institute
The right to marry is a basic human right that should be available to all, regardless of sexual orientation or gender identity.	Fairness and Equality	4	en	Lambda Legal
The legality and constitutionality of our immigration policies must be guided by the principles of due process, equal protection, and respect for human rights.	Legality, Constitutionality, Jurisdiction	5	en	American Bar Association
The Supreme Court has recognized that marriage is a fundamental right that cannot be denied based on gender or sexual orientation.	Legality, Constitutionality, Jurisdiction	5	en	Human Rights Campaign
The legality and constitutionality of same-sex marriage is firmly established by the U.S. Supreme Court, which has recognized that the fundamental right to marry is a core component of individual liberty and equality.	Legality, Constitutionality, Jurisdiction	5	en	Lambda Legal
The Constitution guarantees equal protection under the law to all individuals, including those in same-sex relationships, and this principle must be upheld by the courts and the government.	Legality, Constitutionality, Jurisdiction	5	en	Lambda Legal
The legality and constitutionality of our immigration policies must be grounded in principles of fairness, equality, and justice, and must provide meaningful protection for vulnerable populations.	Legality, Constitutionality, Jurisdiction	5	en	American Civil Liberties Union
The government has the authority to regulate immigration, but this authority is not unlimited and must be exercised in accordance with the Constitution and the rule of law.	Legality, Constitutionality, Jurisdiction	5	en	American Immigration Council
The jurisprudence of immigration law must recognize the importance of family reunification, the rights of refugees and asylum seekers, and the need for a fair and efficient system that promotes economic growth and social integration.	Legality, Constitutionality, Jurisdiction	5	en	University of California, Berkeley School of Law
The authority of the federal government to recognize same-sex marriage is established by the U.S. Constitution, and must be exercised in a manner that is consistent with our values of equality and justice.	Legality, Constitutionality, Jurisdiction	5	en	National Immigration Forum
The jurisprudence of immigration law must recognize the importance of balancing the competing interests of national security, economic growth, and human rights, while ensuring that our policies are both effective and humane.	Legality, Constitutionality, Jurisdiction	5	en	Yale Law School
The Supreme Court has established that marriage is a fundamental right that is protected by the Constitution, and this right must be extended to all couples, regardless of their sexual orientation.	Legality, Constitutionality, Jurisdiction	5	en	Human Rights Campaign
To address the issue of illegal immigration, policies must be enacted that provide a path to citizenship for undocumented immigrants.	Policy Prescription and Evaluation	6	en	The Brookings Institution
Policies aimed at promoting family reunification are essential to ensuring that families are not torn apart by immigration policies.	Policy Prescription and Evaluation	6	en	National Immigration Law Centre
To promote the economic integration of immigrants, policies must be implemented that provide access to education and job training programs.	Policy Prescription and Evaluation	6	en	American Immigration Council
Policies aimed at improving the immigration process must be designed with input from stakeholders, including immigrants and their families.	Policy Prescription and Evaluation	6	en	Human Rights Campaign
Policies aimed at promoting the well-being of immigrant children must take into account their unique needs and ensure that they are able to fully participate in society.	Policy Prescription and Evaluation	6	en	Lambda Legal
To address the challenges of illegal immigration, we must adopt policies that provide a pathway to citizenship for undocumented immigrants, while strengthening our border security and improving our visa system.	Policy Prescription and Evaluation	6	en	Human Rights Campaign
To promote equality and non-discrimination, we should expand protections for LGBTQ individuals in all areas of law, including employment, housing, and public accommodations.	Policy Prescription and Evaluation	6	en	Lambda Legal
To reduce the stigma and discrimination faced by LGBTQ individuals, we should promote education and awareness campaigns, and provide resources and support for LGBTQ individuals and families.	Policy Prescription and Evaluation	6	en	Williams Institute
To promote social inclusion and equality, we should ensure that same-sex couples have access to the same benefits and protections as opposite-sex couples, including employment benefits, healthcare, and family leave.	Policy Prescription and Evaluation	6	en	Human Rights Campaign
To promote accountability and transparency in our immigration policies, we should establish a robust oversight and monitoring system, and provide meaningful opportunities for public input and participation.	Policy Prescription and Evaluation	6	en	Immigrant Legal Resource Centre
Immigration laws have been a controversial issue for many years, with debates raging about their effectiveness and impact on society.	Crime and Punishment	7	en	Lambda Legal
Same-sex marriage laws have been a contentious topic in many countries, with debates raging about their implications for traditional marriage and family structures.	Crime and Punishment	7	en	Centre for American Progress
Immigration laws have been criticized for their impact on vulnerable populations, including refugees and asylum seekers.	Crime and Punishment	7	en	Human Rights Campaign
Immigration laws have been shown to have a significant impact on the economy, with debates raging about their effectiveness in addressing issues such as job displacement and wage suppression.	Crime and Punishment	7	en	Centre for American Progress
The effectiveness of same-sex marriage laws is often measured by their ability to provide legal recognition and protections to same-sex couples, including access to healthcare and inheritance rights.	Crime and Punishment	7	en	Human Rights Campaign
The implications of same-sex marriage laws are often discussed in the context of broader debates about the role of the state in regulating personal relationships.	Crime and Punishment	7	en	Centre for American Progress
The enforcement of immigration laws has been criticized for its reliance on racial profiling and other discriminatory practices.	Crime and Punishment	7	en	Human Rights Campaign
The criminalization of same-sex relationships has been used to justify violence and discrimination against LGBTQ+ individuals in many parts of the world, often with the tacit or explicit approval of state authorities.	Crime and Punishment	7	en	News by government
Laws criminalizing same-sex relationships and marriage have been used to justify discrimination and violence against LGBTQ+ individuals, both by state actors and private citizens.	Crime and Punishment	7	en	Human Rights Campaign
The criminalization of undocumented immigration has led to a situation where simply being in the wrong place at the wrong time can result in detention and deportation.	Crime and Punishment	7	en	Lambda Legal
The government's immigration policies have sparked debate over whether they pose a threat to the welfare of immigrant families and communities.	Security and Defense	8	en	CNN
Same-sex marriage has been a divisive issue in the military, with some arguing that it undermines the effectiveness of the armed forces.	Security and Defense	8	en	Military Times
The rise in illegal immigration has led to increased border security measures, including the construction of a wall along the US-Mexico border.	Security and Defense	8	en	News by government
The government's immigration policies have been criticized for their lack of compassion towards refugees and asylum seekers.	Security and Defense	8	en	Article for trump controversial policies
Critics of immigration policies argue that they have contributed to the spread of disease and other health risks.	Security and Defense	8	en	The New York Times
To protect the security of the nation, policies must be enacted that ensure the safety of citizens and prevent individuals who may pose a threat from entering the country.	Security and Defense	8	en	Migration Policy Institute
Policies aimed at promoting the safety and well-being of LGBT individuals must take into account the potential security risks posed by hate groups or extremist ideologies.	Security and Defense	8	en	Southern Poverty Law Centre
To address the issue of discrimination against same-sex couples, policies must be implemented that ensure their safety and protection from hate crimes and other forms of violence.	Security and Defense	8	en	Human Rights Campaign
Policies aimed at promoting the rights of immigrants must take into account the potential security risks posed by individuals who may seek to engage in criminal activity.	Security and Defense	8	en	Centre for American Progress
To protect the security of the nation, policies must be enacted that ensure that individuals who are in the country illegally are properly identified and removed from the country.	Security and Defense	8	en	Migration Policy Institute
Studies have shown that immigrants face barriers to accessing healthcare, including language barriers and fear of deportation.	Health and Safety	9	en	Migration Policy Institute.
Detention centers for immigrants have been found to have unsanitary conditions and inadequate healthcare services.	Health and Safety	9	en	Human Rights Watch.
Immigrants living in overcrowded and unsanitary conditions are at higher risk for infectious diseases.	Health and Safety	9	en	Centers for Disease Control and Prevention
Public health officials have expressed concern about the spread of diseases among undocumented immigrants.	Health and Safety	9	en	American Public Health Association.
The Affordable Care Act has expanded access to healthcare for many immigrants, but some still face barriers due to their immigration status.	Health and Safety	9	en	National Immigration Law Centre.
The denial of healthcare to same-sex couples violates their human rights and can have serious health consequences.	Health and Safety	9	en	Human Rights Watch. 
Undocumented immigrants face significant barriers in accessing healthcare, which can lead to untreated illnesses and worse health outcomes.	Health and Safety	9	en	American Medical Association
Detention centers for immigrants have been found to have inadequate healthcare services and unsanitary conditions, putting detainees' health at risk.	Health and Safety	9	en	Human Rights
Public health officials have expressed concern about the spread of communicable diseases among immigrants and the general population.	Health and Safety	9	en	the National Institutes of Health
The Affordable Care Act has expanded access to healthcare for many immigrants, but some still face barriers due to their immigration status.	Health and Safety	9	en	Health Coverage for Immigrants
Immigrants' quality of life and mental health are affected by their status in the United States.	Quality of Life	10	en	Medical News Today
Marriage equality provides same-sex couples with legal and financial security, improving their quality of life.	Quality of Life	10	en	the American Psychological Association
Lack of access to healthcare can lead to reduced quality of life for immigrants, including undocumented immigrants.	Quality of Life	10	en	the National Immigration Law Centre
Opponents of same-sex marriage argue that it threatens the traditional family structure, potentially harming the quality of life for children.	Quality of Life	10	en	The Heritage Foundation
Immigrants contribute to the U.S. economy and society, but policies that limit opportunities for immigrants can have a negative impact on their quality of life and well-being.	Quality of Life	10	en	Migration Policy Institute
Same-sex marriage can lead to increased social acceptance and support, improving the well-being and quality of life of LGBTQ+ individuals.	Quality of Life	10	en	Human Rights Campaign
Undocumented immigrants face numerous challenges, including limited job opportunities, which can impact their financial security and quality of life.	Quality of Life	10	en	the American Immigration Council
Opponents of same-sex marriage argue that it goes against traditional religious beliefs, potentially harming the quality of life for religious individuals.	Quality of Life	10	en	Family Research Council
Same-sex marriage can lead to greater access to healthcare and insurance coverage for LGBTQ+ individuals, improving their quality of life.	Quality of Life	10	en	the National LGBTQ Task Force
Immigrants who face family separation due to deportation or detention may experience trauma and emotional distress, negatively impacting their quality of life.	Quality of Life	10	en	the Centre for American Progress
Same-sex marriage challenges traditional cultural norms, but ultimately strengthens our society by recognizing and celebrating the love between two individuals.	Cultural Identity	11	en	Human Rights Campaign
Immigrants have contributed to the richness and diversity of American culture throughout history, and continue to do so today.	Cultural Identity	11	en	National Immigration Forum
Immigrants bring with them unique cultural perspectives that can enhance our understanding of the world and promote cross-cultural understanding.	Cultural Identity	11	en	Migration Policy Institute
Same-sex marriage is a reflection of the changing cultural attitudes towards gender and sexuality, and the importance of equality in our society.	Cultural Identity	11	en	Human Rights Campaign
Immigration policies that fail to recognize the cultural identity of immigrant communities can lead to social exclusion and marginalization.	Cultural Identity	11	en	European Union Agency for Fundamental Rights
Immigrants can maintain their cultural identity while also adapting to their new home, creating a more vibrant and diverse society.	Cultural Identity	11	en	New American Economy
Same-sex marriage challenges traditional cultural values, but it also represents the triumph of love and the recognition of the humanity of all individuals.	Cultural Identity	11	en	Lambda Legal
Same-sex marriage is a product of cultural evolution, and reflects the changing attitudes of society towards gender, sexuality, and the meaning of family.	Cultural Identity	11	en	Psychology Today
Immigration policies that recognize and respect cultural identity can promote social harmony and strengthen the fabric of our society.	Cultural Identity	11	en	Migration Policy Institute
Same-sex marriage is a reflection of the struggle for LGBTQ+ rights, and the cultural changes that have made it possible.	Cultural Identity	11	en	Human Rights Watch
Public opinion polls show that most Americans are in favour of granting some form of legal status to undocumented immigrants.	Public Opinion	12	en	article "Immigration Reform: How It Would Affect the Economy"
Polls have consistently shown that public support for same-sex marriage has been steadily increasing over the past few decades.	Public Opinion	12	en	article "Same-Sex Marriage"
A recent survey found that the majority of Americans support same-sex marriage, with 67% of respondents indicating they are in favour of it.	Public Opinion	12	en	article "Same-Sex Marriage and Public Opinion: Looking at the Evidence"
Polls have consistently shown that Americans are divided on the issue of immigration, with some supporting stricter immigration policies while others advocate for a more lenient approach.	Public Opinion	12	en	book "Immigration and the American Identity"
Public opinion polls have shown that the younger generation is more likely to support same-sex marriage than older generations.	Public Opinion	12	en	article "The Generational Divide in Same-Sex Marriage"
Public opinion polls suggest that Americans are more supportive of immigration when they view immigrants as contributing to the economy and society, rather than as a burden on social services.	Public Opinion	12	en	article "The Politics of Immigration and Public Opinion"
Despite a significant shift in public opinion in favor of same-sex marriage over the past decade, there remains a stark partisan divide on the issue.	Public Opinion	12	en	article "The Partisan Divide on Same-Sex Marriage"
Despite public opinion polls indicating strong support for comprehensive immigration reform, lawmakers have been unable to pass meaningful legislation on the issue.	Public Opinion	12	en	article "Immigration Reform: The Politics of Compromise"
A 2020 study by the Pew Research Centre found that Democrats are more likely than Republicans to believe that immigrants strengthen the country and that the growing diversity of the U.S. population is a positive thing.	Public Opinion	12	en	White Nationalists
A Gallup poll from 2020 found that a record-high 70% of Americans believe that same-sex marriage should be legally recognized.	Public Opinion	12	en	article in web
